{
  "schema": "manafold.m2.5.c.relation-application-authority.v2",
  "base_authority_v1_binding": {
    "artifact_role": "base_authority_v1",
    "path": "sources/m2_5/authorities/interaction_review_authority.v1.json",
    "schema": "manafold.m2.5.c.interaction-review-authority.v1",
    "raw_sha256": "0000000000000000000000000000000000000000000000000000000000000000"
  },
  "candidate_universe_binding": {
    "artifact_role": "candidate_universe",
    "path": "sources/m2_5/closures/C/interaction_candidate_universe.v2.json",
    "schema": "manafold.m2.5.c.interaction-candidate-universe.v2",
    "raw_sha256": "0000000000000000000000000000000000000000000000000000000000000000"
  },
  "source_bindings": [
    {
      "artifact_role": "base_authority_v1",
      "path": "sources/m2_5/authorities/interaction_review_authority.v1.json",
      "schema": "manafold.m2.5.c.interaction-review-authority.v1",
      "raw_sha256": "0000000000000000000000000000000000000000000000000000000000000000"
    },
    {
      "artifact_role": "candidate_universe",
      "path": "sources/m2_5/closures/C/interaction_candidate_universe.v2.json",
      "schema": "manafold.m2.5.c.interaction-candidate-universe.v2",
      "raw_sha256": "0000000000000000000000000000000000000000000000000000000000000000"
    }
  ],
  "relation_application_v2_records": [],
  "relation_application_v2_supersession_records": []
}
